{
  "scenario_id": "RP-002",
  "provider": "Google",
  "product": "Antigravity CLI generate_image",
  "model_display_name": "Antigravity built-in image generator",
  "review_status": "provisional",
  "pass_a": {
    "reviewer": "",
    "completed_at": null,
    "frames": [
      {
        "frame_id": "A-wide",
        "decision": "pending",
        "requested_evidence": [
          {
            "name": "bath",
            "visibility": "pending"
          },
          {
            "name": "glass shower screen",
            "visibility": "pending"
          },
          {
            "name": "wash basin",
            "visibility": "pending"
          },
          {
            "name": "WC",
            "visibility": "pending"
          },
          {
            "name": "heated towel rail",
            "visibility": "pending"
          },
          {
            "name": "grey wall tiles",
            "visibility": "pending"
          }
        ],
        "rejection_reasons": []
      },
      {
        "frame_id": "B-reverse",
        "decision": "pending",
        "requested_evidence": [
          {
            "name": "WC",
            "visibility": "pending"
          },
          {
            "name": "wash basin",
            "visibility": "pending"
          },
          {
            "name": "mirror",
            "visibility": "pending"
          },
          {
            "name": "door furniture",
            "visibility": "pending"
          },
          {
            "name": "extractor vent",
            "visibility": "pending"
          },
          {
            "name": "skirting board",
            "visibility": "pending"
          }
        ],
        "rejection_reasons": []
      },
      {
        "frame_id": "C-inventory",
        "decision": "pending",
        "requested_evidence": [
          {
            "name": "glass shower screen",
            "visibility": "pending"
          },
          {
            "name": "mixer taps",
            "visibility": "pending"
          },
          {
            "name": "shower handset",
            "visibility": "pending"
          },
          {
            "name": "extractor vent",
            "visibility": "pending"
          },
          {
            "name": "heated towel rail",
            "visibility": "pending"
          }
        ],
        "rejection_reasons": []
      },
      {
        "frame_id": "D-condition",
        "decision": "pending",
        "requested_evidence": [
          {
            "name": "bath panel",
            "visibility": "pending"
          },
          {
            "name": "silicone seal",
            "visibility": "pending"
          },
          {
            "name": "vinyl floor",
            "visibility": "pending"
          },
          {
            "name": "lower wall tiles",
            "visibility": "pending"
          }
        ],
        "rejection_reasons": []
      }
    ]
  },
  "pass_b": {
    "reviewer": "",
    "completed_at": null,
    "claims": [],
    "negative_controls": [],
    "generator_deviations": []
  }
}
