{
  "scenario_id": "RP-010",
  "provider": "Google",
  "product": "Gemini Omni (owner subscription surface)",
  "model_display_name": "Gemini Omni",
  "review_status": "provisional",
  "pass_a": {
    "reviewer": "",
    "completed_at": null,
    "frames": [
      {
        "frame_id": "A-wide",
        "decision": "pending",
        "requested_evidence": [
          {
            "name": "single bed",
            "visibility": "pending"
          },
          {
            "name": "wardrobe",
            "visibility": "pending"
          },
          {
            "name": "desk",
            "visibility": "pending"
          },
          {
            "name": "blue rug",
            "visibility": "pending"
          },
          {
            "name": "toy storage",
            "visibility": "pending"
          }
        ],
        "rejection_reasons": []
      },
      {
        "frame_id": "B-reverse",
        "decision": "pending",
        "requested_evidence": [
          {
            "name": "door",
            "visibility": "pending"
          },
          {
            "name": "bookcase",
            "visibility": "pending"
          },
          {
            "name": "radiator",
            "visibility": "pending"
          },
          {
            "name": "ceiling shade",
            "visibility": "pending"
          },
          {
            "name": "carpet",
            "visibility": "pending"
          }
        ],
        "rejection_reasons": []
      },
      {
        "frame_id": "C-inventory",
        "decision": "pending",
        "requested_evidence": [
          {
            "name": "desk",
            "visibility": "pending"
          },
          {
            "name": "chair",
            "visibility": "pending"
          },
          {
            "name": "sockets",
            "visibility": "pending"
          },
          {
            "name": "radiator",
            "visibility": "pending"
          },
          {
            "name": "window blind",
            "visibility": "pending"
          }
        ],
        "rejection_reasons": []
      },
      {
        "frame_id": "D-condition",
        "decision": "pending",
        "requested_evidence": [
          {
            "name": "bed frame",
            "visibility": "pending"
          },
          {
            "name": "carpet",
            "visibility": "pending"
          },
          {
            "name": "skirting board",
            "visibility": "pending"
          },
          {
            "name": "blue rug",
            "visibility": "pending"
          }
        ],
        "rejection_reasons": []
      }
    ]
  },
  "pass_b": {
    "reviewer": "",
    "completed_at": null,
    "claims": [],
    "negative_controls": [],
    "generator_deviations": []
  }
}
