{
  "scenario_id": "RP-025",
  "provider": "Google",
  "product": "Antigravity CLI generate_image",
  "model_display_name": "Antigravity built-in image generator",
  "review_status": "provisional",
  "pass_a": {
    "reviewer": "",
    "completed_at": null,
    "frames": [
      {
        "frame_id": "A-wide",
        "decision": "pending",
        "requested_evidence": [
          {
            "name": "glass balustrade",
            "visibility": "pending"
          },
          {
            "name": "two metal chairs",
            "visibility": "pending"
          },
          {
            "name": "small table",
            "visibility": "pending"
          },
          {
            "name": "planters",
            "visibility": "pending"
          },
          {
            "name": "floor tiles",
            "visibility": "pending"
          }
        ],
        "rejection_reasons": []
      },
      {
        "frame_id": "B-reverse",
        "decision": "pending",
        "requested_evidence": [
          {
            "name": "patio door",
            "visibility": "pending"
          },
          {
            "name": "external light",
            "visibility": "pending"
          },
          {
            "name": "wall vent",
            "visibility": "pending"
          },
          {
            "name": "chairs",
            "visibility": "pending"
          },
          {
            "name": "threshold",
            "visibility": "pending"
          }
        ],
        "rejection_reasons": []
      },
      {
        "frame_id": "C-inventory",
        "decision": "pending",
        "requested_evidence": [
          {
            "name": "balustrade glass",
            "visibility": "pending"
          },
          {
            "name": "metal posts",
            "visibility": "pending"
          },
          {
            "name": "drain outlet",
            "visibility": "pending"
          },
          {
            "name": "planters",
            "visibility": "pending"
          },
          {
            "name": "external socket",
            "visibility": "pending"
          }
        ],
        "rejection_reasons": []
      },
      {
        "frame_id": "D-condition",
        "decision": "pending",
        "requested_evidence": [
          {
            "name": "floor tiles",
            "visibility": "pending"
          },
          {
            "name": "grout",
            "visibility": "pending"
          },
          {
            "name": "drain channel",
            "visibility": "pending"
          },
          {
            "name": "chair leg",
            "visibility": "pending"
          }
        ],
        "rejection_reasons": []
      }
    ]
  },
  "pass_b": {
    "reviewer": "",
    "completed_at": null,
    "claims": [],
    "negative_controls": [],
    "generator_deviations": []
  }
}
