{
  "scenario_id": "RP-006",
  "provider": "Google",
  "product": "Gemini Omni (owner subscription surface)",
  "model_display_name": "Gemini Omni",
  "review_status": "provisional",
  "pass_a": {
    "reviewer": "",
    "completed_at": null,
    "frames": [
      {
        "frame_id": "A-wide",
        "decision": "pending",
        "requested_evidence": [
          {
            "name": "walk-in shower",
            "visibility": "pending"
          },
          {
            "name": "WC",
            "visibility": "pending"
          },
          {
            "name": "vanity basin",
            "visibility": "pending"
          },
          {
            "name": "heated towel rail",
            "visibility": "pending"
          },
          {
            "name": "stone wall tiles",
            "visibility": "pending"
          }
        ],
        "rejection_reasons": []
      },
      {
        "frame_id": "B-reverse",
        "decision": "pending",
        "requested_evidence": [
          {
            "name": "door",
            "visibility": "pending"
          },
          {
            "name": "vanity unit",
            "visibility": "pending"
          },
          {
            "name": "mirror",
            "visibility": "pending"
          },
          {
            "name": "extractor vent",
            "visibility": "pending"
          },
          {
            "name": "floor tiles",
            "visibility": "pending"
          }
        ],
        "rejection_reasons": []
      },
      {
        "frame_id": "C-inventory",
        "decision": "pending",
        "requested_evidence": [
          {
            "name": "rain shower",
            "visibility": "pending"
          },
          {
            "name": "handset",
            "visibility": "pending"
          },
          {
            "name": "mixer controls",
            "visibility": "pending"
          },
          {
            "name": "glass screen",
            "visibility": "pending"
          },
          {
            "name": "floor drain",
            "visibility": "pending"
          }
        ],
        "rejection_reasons": []
      },
      {
        "frame_id": "D-condition",
        "decision": "pending",
        "requested_evidence": [
          {
            "name": "vanity drawer",
            "visibility": "pending"
          },
          {
            "name": "basin edge",
            "visibility": "pending"
          },
          {
            "name": "mixer tap",
            "visibility": "pending"
          },
          {
            "name": "silicone joint",
            "visibility": "pending"
          }
        ],
        "rejection_reasons": []
      }
    ]
  },
  "pass_b": {
    "reviewer": "",
    "completed_at": null,
    "claims": [],
    "negative_controls": [],
    "generator_deviations": []
  }
}
