{
  "scenario_id": "RP-004",
  "provider": "Google",
  "product": "Antigravity CLI generate_image",
  "model_display_name": "Antigravity built-in image generator",
  "review_status": "provisional",
  "pass_a": {
    "reviewer": "",
    "completed_at": null,
    "frames": [
      {
        "frame_id": "A-wide",
        "decision": "pending",
        "requested_evidence": [
          {
            "name": "wood-effect units",
            "visibility": "pending"
          },
          {
            "name": "laminate worktop",
            "visibility": "pending"
          },
          {
            "name": "freestanding cooker",
            "visibility": "pending"
          },
          {
            "name": "sink",
            "visibility": "pending"
          },
          {
            "name": "patterned vinyl floor",
            "visibility": "pending"
          }
        ],
        "rejection_reasons": []
      },
      {
        "frame_id": "B-reverse",
        "decision": "pending",
        "requested_evidence": [
          {
            "name": "entrance door",
            "visibility": "pending"
          },
          {
            "name": "radiator",
            "visibility": "pending"
          },
          {
            "name": "window blind",
            "visibility": "pending"
          },
          {
            "name": "wall clock",
            "visibility": "pending"
          },
          {
            "name": "skirting",
            "visibility": "pending"
          }
        ],
        "rejection_reasons": []
      },
      {
        "frame_id": "C-inventory",
        "decision": "pending",
        "requested_evidence": [
          {
            "name": "sink",
            "visibility": "pending"
          },
          {
            "name": "draining board",
            "visibility": "pending"
          },
          {
            "name": "mixer tap",
            "visibility": "pending"
          },
          {
            "name": "sockets",
            "visibility": "pending"
          },
          {
            "name": "under-counter fridge",
            "visibility": "pending"
          }
        ],
        "rejection_reasons": []
      },
      {
        "frame_id": "D-condition",
        "decision": "pending",
        "requested_evidence": [
          {
            "name": "vinyl floor",
            "visibility": "pending"
          },
          {
            "name": "plinth",
            "visibility": "pending"
          },
          {
            "name": "base unit",
            "visibility": "pending"
          },
          {
            "name": "cooker side",
            "visibility": "pending"
          }
        ],
        "rejection_reasons": []
      }
    ]
  },
  "pass_b": {
    "reviewer": "",
    "completed_at": null,
    "claims": [],
    "negative_controls": [],
    "generator_deviations": []
  }
}
