{
  "scenario_id": "RP-017",
  "provider": "Google",
  "product": "Gemini Omni (owner subscription surface)",
  "model_display_name": "Gemini Omni",
  "review_status": "provisional",
  "pass_a": {
    "reviewer": "",
    "completed_at": null,
    "frames": [
      {
        "frame_id": "A-wide",
        "decision": "pending",
        "requested_evidence": [
          {
            "name": "dark dining table",
            "visibility": "pending"
          },
          {
            "name": "four chairs",
            "visibility": "pending"
          },
          {
            "name": "display cabinet",
            "visibility": "pending"
          },
          {
            "name": "chandelier",
            "visibility": "pending"
          },
          {
            "name": "carpet",
            "visibility": "pending"
          }
        ],
        "rejection_reasons": []
      },
      {
        "frame_id": "B-reverse",
        "decision": "pending",
        "requested_evidence": [
          {
            "name": "door",
            "visibility": "pending"
          },
          {
            "name": "fireplace",
            "visibility": "pending"
          },
          {
            "name": "radiator",
            "visibility": "pending"
          },
          {
            "name": "curtains",
            "visibility": "pending"
          },
          {
            "name": "wallpaper",
            "visibility": "pending"
          }
        ],
        "rejection_reasons": []
      },
      {
        "frame_id": "C-inventory",
        "decision": "pending",
        "requested_evidence": [
          {
            "name": "glass cabinet",
            "visibility": "pending"
          },
          {
            "name": "wall sockets",
            "visibility": "pending"
          },
          {
            "name": "radiator",
            "visibility": "pending"
          },
          {
            "name": "thermostat",
            "visibility": "pending"
          },
          {
            "name": "skirting",
            "visibility": "pending"
          }
        ],
        "rejection_reasons": []
      },
      {
        "frame_id": "D-condition",
        "decision": "pending",
        "requested_evidence": [
          {
            "name": "tabletop",
            "visibility": "pending"
          },
          {
            "name": "table edge",
            "visibility": "pending"
          },
          {
            "name": "tablecloth",
            "visibility": "pending"
          },
          {
            "name": "chair back",
            "visibility": "pending"
          }
        ],
        "rejection_reasons": []
      }
    ]
  },
  "pass_b": {
    "reviewer": "",
    "completed_at": null,
    "claims": [],
    "negative_controls": [],
    "generator_deviations": []
  }
}
