{
  "scenario_id": "RP-006",
  "provider": "Google",
  "product": "Antigravity CLI generate_image",
  "model_display_name": "Antigravity built-in image generator",
  "review_status": "provisional",
  "pass_a": {
    "reviewer": "Independent AI review with owner exceptions",
    "completed_at": "2026-07-29",
    "frames": [
      {
        "frame_id": "A-wide",
        "decision": "accepted",
        "requested_evidence": [
          {
            "name": "walk-in shower",
            "visibility": "clear"
          },
          {
            "name": "WC",
            "visibility": "clear"
          },
          {
            "name": "vanity basin",
            "visibility": "clear"
          },
          {
            "name": "heated towel rail",
            "visibility": "clear"
          },
          {
            "name": "stone wall tiles",
            "visibility": "clear"
          }
        ],
        "rejection_reasons": [],
        "ai_review": {
          "source": "phase3-pass-a-review-2026-07-29.json",
          "reviewed_at": "2026-07-29",
          "decision": "accept",
          "reason": "Walk-in shower, WC, vanity, towel rail, stone tiles present",
          "second_review_agreed": true
        }
      },
      {
        "frame_id": "B-reverse",
        "decision": "accepted",
        "requested_evidence": [
          {
            "name": "door",
            "visibility": "clear"
          },
          {
            "name": "vanity unit",
            "visibility": "clear"
          },
          {
            "name": "mirror",
            "visibility": "clear"
          },
          {
            "name": "extractor vent",
            "visibility": "clear"
          },
          {
            "name": "floor tiles",
            "visibility": "clear"
          }
        ],
        "rejection_reasons": [],
        "ai_review": {
          "source": "phase3-pass-a-review-2026-07-29.json",
          "reviewed_at": "2026-07-29",
          "decision": "escalate",
          "reason": "Extractor vent absent; three towel rails + mirror reflection mismatch (geometry/continuity) [reconciled from reviewer disagreement: was reject, second review accept]",
          "second_review_agreed": null
        },
        "owner_adjudication": {
          "task_id": "RP-006.antigravity-builtin.B-reverse",
          "scenario_id": "RP-006",
          "provider": "Google",
          "view_id": "B-reverse",
          "path": "evals\\fixtures\\synthetic-room-eval\\images\\antigravity\\builtin\\RP-006-B-reverse.jpg",
          "ai_decision": "escalate",
          "ai_reason": "Extractor vent absent; three towel rails + mirror reflection mismatch (geometry/continuity) [reconciled from reviewer disagreement: was reject, second review accept]",
          "owner_decision": "accept",
          "owner_reason": "Extractor vent absent; three towel rails + mirror reflection mismatch (geometry/continuity) [reconciled from reviewer disagreement: was reject, second review accept]",
          "adjudicated_at": "2026-07-29T19:22:06.755Z"
        }
      },
      {
        "frame_id": "C-inventory",
        "decision": "accepted",
        "requested_evidence": [
          {
            "name": "rain shower",
            "visibility": "clear"
          },
          {
            "name": "handset",
            "visibility": "clear"
          },
          {
            "name": "mixer controls",
            "visibility": "clear"
          },
          {
            "name": "glass screen",
            "visibility": "clear"
          },
          {
            "name": "floor drain",
            "visibility": "clear"
          }
        ],
        "rejection_reasons": [],
        "ai_review": {
          "source": "phase3-pass-a-review-2026-07-29.json",
          "reviewed_at": "2026-07-29",
          "decision": "accept",
          "reason": "Rain head, handset, mixer, glass, floor drain present",
          "second_review_agreed": true
        }
      },
      {
        "frame_id": "D-condition",
        "decision": "accepted",
        "requested_evidence": [
          {
            "name": "vanity drawer",
            "visibility": "clear"
          },
          {
            "name": "basin edge",
            "visibility": "clear"
          },
          {
            "name": "mixer tap",
            "visibility": "clear"
          },
          {
            "name": "silicone joint",
            "visibility": "clear"
          }
        ],
        "rejection_reasons": [],
        "ai_review": {
          "source": "phase3-pass-a-review-2026-07-29.json",
          "reviewed_at": "2026-07-29",
          "decision": "escalate",
          "reason": "Chip on drawer corner present; silicone joint not clearly shown; mixer only partial",
          "second_review_agreed": true
        },
        "owner_adjudication": {
          "task_id": "RP-006.antigravity-builtin.D-condition",
          "scenario_id": "RP-006",
          "provider": "Google",
          "view_id": "D-condition",
          "path": "evals\\fixtures\\synthetic-room-eval\\images\\antigravity\\builtin\\RP-006-D-condition.jpg",
          "ai_decision": "escalate",
          "ai_reason": "Chip on drawer corner present; silicone joint not clearly shown; mixer only partial",
          "owner_decision": "accept",
          "owner_reason": "Chip on drawer corner present; silicone joint not clearly shown; mixer only partial",
          "adjudicated_at": "2026-07-29T19:22:16.882Z"
        }
      }
    ],
    "source_review": "phase3-pass-a-review-2026-07-29.json",
    "provenance_warning": "The source aggregate did not record reviewer model IDs or review-prompt hashes. This historical Pass A decision set is retained, but does not satisfy the stronger provenance requirement for retry reviews."
  },
  "pass_b": {
    "reviewer": "",
    "completed_at": null,
    "claims": [],
    "negative_controls": [],
    "generator_deviations": []
  }
}
